{
  "schemaType": "stateResearch",
  "recordStatus": "template",
  "siteKey": "roller-rink-rentals",
  "stateName": "Template State",
  "stateCode": "XX",
  "primaryService": "Portable Roller Rink Rentals",
  "primaryKeyword": "portable roller rink rentals",
  "researchStatus": "not_started",
  "researchedAt": "",
  "researchedBy": "",
  "topProviders": [],
  "shortlistedProviders": [],
  "targetMetros": [],
  "targetCities": [],
  "eventDemandZones": [],
  "majorVenueTypes": [],
  "seasonalNotes": "TEMPLATE: Add seasonal demand notes after research.",
  "climateLogisticsNotes": "TEMPLATE: Add indoor/outdoor surface and event logistics notes after research.",
  "serviceCoverageNotes": "TEMPLATE: Add confirmed partner/provider coverage notes after research.",
  "partnerCoverageStatus": "research_only_until_provider_confirmed",
  "fulfillmentNotes": "Template only. No direct partner/provider coverage is claimed here.",
  "recommendedPageCount": 0,
  "pageRecommendations": [],
  "warnings": [],
  "nextResearchActions": [
    "Research partner coverage before recommending publishable pages.",
    "Identify unique event, venue, geography, or lead-value reasons before page creation."
  ]
}
